{
  "schema_version": 1,
  "report_date": "2026-05-27",
  "generated_at": "2026-05-26T18:45:00.000Z",
  "sources": [
    {
      "id": "microsoft-copilot-studio-may",
      "name": "Microsoft Copilot Studio May 2026 update",
      "url": "https://www.microsoft.com/en-us/microsoft-copilot/blog/copilot-studio/new-and-improved-computer-using-agents-a-new-workflows-experience-and-real-time-voice-experiences/",
      "category": "official_release",
      "status": "checked",
      "checked_at": "2026-05-26T18:45:00.000Z",
      "notes": "Microsoft published the May 2026 Copilot Studio update on 2026-05-26, including computer-using agents GA, workflow changes, Work IQ extensibility and voice agent updates."
    },
    {
      "id": "openai-status",
      "name": "OpenAI Status",
      "url": "https://status.openai.com/",
      "category": "official_release",
      "status": "checked",
      "checked_at": "2026-05-26T18:45:00.000Z",
      "notes": "Status page showed an identified login issue for FedRAMP users who recently logged out, affecting ChatGPT and FedRAMP."
    },
    {
      "id": "checkpoint-frontier-ai-readiness",
      "name": "Check Point Frontier AI Models Readiness Program security update",
      "url": "https://blog.checkpoint.com/security/check-point-frontier-ai-models-readiness-program-security-update/",
      "category": "official_release",
      "status": "checked",
      "checked_at": "2026-05-26T18:45:00.000Z",
      "notes": "Check Point published a 2026-05-26 update tying frontier-model readiness work to a Jumbo Security Release and BLAST validation."
    },
    {
      "id": "huggingface-borealis-blog",
      "name": "Borealis training recipe blog",
      "url": "https://huggingface.co/blog/AlexWortega/borealis",
      "category": "blog",
      "status": "checked",
      "checked_at": "2026-05-26T18:45:00.000Z",
      "notes": "Hugging Face community article published on 2026-05-25 describing Borealis, an open data/code/weights recipe for an audio-language model."
    },
    {
      "id": "huggingface-borealis-model",
      "name": "Vikhrmodels/Borealis-5b-it model card",
      "url": "https://huggingface.co/Vikhrmodels/Borealis-5b-it",
      "category": "model_registry",
      "status": "checked",
      "checked_at": "2026-05-26T18:45:00.000Z",
      "notes": "Model card lists Apache-2.0 license, Whisper Large V3 encoder, Qwen3-4B language model and vLLM plugin instructions."
    },
    {
      "id": "huggingface-agent-glossary",
      "name": "Hugging Face agent glossary",
      "url": "https://huggingface.co/blog/agent-glossary",
      "category": "blog",
      "status": "checked",
      "checked_at": "2026-05-26T18:45:00.000Z",
      "notes": "Published 2026-05-25 and explains agent, harness, scaffolding, context engineering, tool use and skills terminology."
    },
    {
      "id": "github-trending-shell",
      "name": "GitHub Trending discovery command",
      "url": "https://github.com/trending?since=daily",
      "category": "github_trending",
      "status": "blocked",
      "checked_at": "2026-05-26T18:45:00.000Z",
      "notes": "npm run discover:github-trending -- --date 2026-05-27 --limit 50 returned fetch failed for GitHub Trending pages and OSSInsight API."
    },
    {
      "id": "github-trending-web",
      "name": "GitHub Trending web check",
      "url": "https://github.com/trending?since=daily",
      "category": "github_trending",
      "status": "checked",
      "checked_at": "2026-05-26T18:45:00.000Z",
      "notes": "Web open confirmed GitHub Trending page availability, but repo rows were not reliably exposed in the captured page."
    },
    {
      "id": "trendingrepo-anthropics-plugins",
      "name": "TrendingRepo anthropics/knowledge-work-plugins",
      "url": "https://trendingrepo.com/repo/anthropics/knowledge-work-plugins",
      "category": "github_trending",
      "status": "checked",
      "checked_at": "2026-05-26T18:45:00.000Z",
      "notes": "TrendingRepo reported anthropics/knowledge-work-plugins GitHub momentum with recent stars and a recent commit; GitHub repo was opened separately."
    },
    {
      "id": "github-anthropics-plugins",
      "name": "anthropics/knowledge-work-plugins",
      "url": "https://github.com/anthropics/knowledge-work-plugins",
      "category": "repository",
      "status": "checked",
      "checked_at": "2026-05-26T18:45:00.000Z",
      "notes": "GitHub page confirms the Apache-2.0 repository for Claude Cowork and Claude Code plugins, with role plugins, skills, connectors and slash commands."
    },
    {
      "id": "builder-fallback-command",
      "name": "Builder fallback RSS command",
      "url": "https://simonwillison.net/atom/everything/",
      "category": "builder",
      "status": "blocked",
      "checked_at": "2026-05-26T18:45:00.000Z",
      "notes": "npm run discover:builders -- --date 2026-05-27 --limit 20 returned fetch failed for Simon Willison, Chip Huyen and Andrej Karpathy feeds."
    },
    {
      "id": "follow-builders-x",
      "name": "follow-builders X feed",
      "url": "https://raw.githubusercontent.com/zarazhangrui/follow-builders/main/feed-x.json",
      "category": "builder",
      "status": "checked",
      "checked_at": "2026-05-27T04:28:44.802Z",
      "notes": "discover:builders parsed 18 recent original X entries from the central follow-builders feed."
    },
    {
      "id": "claude-status",
      "name": "Claude Status",
      "url": "https://status.claude.com/",
      "category": "official_release",
      "status": "checked",
      "checked_at": "2026-05-26T18:45:00.000Z",
      "notes": "Claude Status lists a 2026-05-26 resolved incident for elevated errors in Claude Code in Slack."
    }
  ],
  "candidates": [
    {
      "id": "main-microsoft-copilot-studio-computer-use",
      "source_id": "microsoft-copilot-studio-may",
      "category": "main_item",
      "title": "Microsoft Copilot Studio 发布 computer-using agents GA 与工作流更新",
      "url": "https://www.microsoft.com/en-us/microsoft-copilot/blog/copilot-studio/new-and-improved-computer-using-agents-a-new-workflows-experience-and-real-time-voice-experiences/",
      "source": "Microsoft Copilot Blog",
      "event_date": "2026-05-26",
      "status": "included",
      "included_in": "main_items",
      "evidence": "Microsoft's May 2026 Copilot Studio update says computer-using agents are generally available and describes workflow, Work IQ, MCP, A2A and voice agent changes."
    },
    {
      "id": "main-openai-fedramp-login-status",
      "source_id": "openai-status",
      "category": "main_item",
      "title": "OpenAI Status 显示 FedRAMP 用户登录问题仍在处理",
      "url": "https://status.openai.com/",
      "source": "OpenAI Status",
      "event_date": "2026-05-26",
      "status": "included",
      "included_in": "main_items",
      "evidence": "OpenAI Status showed an ongoing identified incident affecting ChatGPT and FedRAMP login for recently logged-out FedRAMP users."
    },
    {
      "id": "main-checkpoint-frontier-ai-readiness",
      "source_id": "checkpoint-frontier-ai-readiness",
      "category": "main_item",
      "title": "Check Point 把 frontier AI 扫描结果落到安全发布流程",
      "url": "https://blog.checkpoint.com/security/check-point-frontier-ai-models-readiness-program-security-update/",
      "source": "Check Point Blog",
      "event_date": "2026-05-26",
      "status": "included",
      "included_in": "main_items",
      "evidence": "Check Point says its Frontier AI Models Readiness Program used large-scale AI-driven code scanning, validation and hardening, with fixes landing in a Jumbo Security Release."
    },
    {
      "id": "model-borealis-5b-it",
      "source_id": "huggingface-borealis-model",
      "category": "model_release",
      "title": "Borealis-5B-IT",
      "url": "https://huggingface.co/Vikhrmodels/Borealis-5b-it",
      "source": "Hugging Face Model Card",
      "event_date": "2026-05-25",
      "status": "included",
      "included_in": "model_releases",
      "evidence": "The model card lists Borealis-5B-IT as an Apache-2.0 audio-language model built with Whisper Large V3, Qwen3-4B and a trained adapter, with vLLM support."
    },
    {
      "id": "blog-hf-agent-glossary",
      "source_id": "huggingface-agent-glossary",
      "category": "hot_blog",
      "title": "Harness, Scaffold, and the AI Agent Terms Worth Getting Right",
      "url": "https://huggingface.co/blog/agent-glossary",
      "source": "Hugging Face Blog",
      "event_date": "2026-05-25",
      "status": "included",
      "included_in": "hot_blogs",
      "evidence": "The article was published on 2026-05-25 and gives working definitions for model, scaffold, harness, agent, context engineering, skills and related terms."
    },
    {
      "id": "project-anthropics-knowledge-work-plugins",
      "source_id": "github-anthropics-plugins",
      "category": "project",
      "title": "anthropics/knowledge-work-plugins",
      "url": "https://github.com/anthropics/knowledge-work-plugins",
      "source": "GitHub",
      "event_date": "2026-05-26",
      "status": "included",
      "included_in": "projects",
      "evidence": "GitHub confirms the repo contents and license; TrendingRepo supplied the 2026-05-26 momentum cue used only as discovery evidence."
    },
    {
      "id": "builder-peter-yang-codex-browser-test",
      "source_id": "follow-builders-x",
      "category": "builder_observation",
      "title": "Peter Yang: Codex uses browser to test its own work",
      "url": "https://x.com/petergyang/status/2059099566377693305",
      "source": "follow-builders X feed",
      "event_date": "2026-05-26",
      "status": "included",
      "included_in": "builder_observations",
      "evidence": "Peter Yang said Codex is very good and especially impressive because it uses the browser to test its own work, while Claude still wins on design and frontend tasks."
    },
    {
      "id": "builder-garry-tan-agent-evals",